-- Regression tests for pg_roaring_index.
-- Covers: extension load, build, scan, pending list, VACUUM (ambulkdelete +
-- vacuumcleanup/merge), delete+reinsert, empty-bitmap handling, int4 opclass.
CREATE EXTENSION pg_roaring_index;
SELECT amname FROM pg_am WHERE amname = 'roaring';
 amname  
---------
 roaring
(1 row)

-- ----------------------------------------------------------------
-- 1. Basic build and equality lookups
-- ----------------------------------------------------------------
CREATE TABLE roaring_test (id int, val bigint);
INSERT INTO roaring_test VALUES
    (1, 1), (2, 1),           -- val=1: 2 rows
    (3, 2),                   -- val=2: 1 row
    (4, 3), (5, 3), (6, 3);   -- val=3: 3 rows
CREATE INDEX roaring_test_idx ON roaring_test USING roaring (val);
-- Merge pending list into main index before testing.
VACUUM roaring_test;
SET enable_seqscan = off;
SELECT count(*) AS cnt_val1 FROM roaring_test WHERE val = 1;
 cnt_val1 
----------
        2
(1 row)

SELECT count(*) AS cnt_val2 FROM roaring_test WHERE val = 2;
 cnt_val2 
----------
        1
(1 row)

SELECT count(*) AS cnt_val3 FROM roaring_test WHERE val = 3;
 cnt_val3 
----------
        3
(1 row)

SELECT count(*) AS cnt_val99 FROM roaring_test WHERE val = 99;  -- absent
 cnt_val99 
-----------
         0
(1 row)

-- ----------------------------------------------------------------
-- 2. Plan shape
-- ----------------------------------------------------------------
EXPLAIN (COSTS OFF) SELECT id FROM roaring_test WHERE val = 1;
                 QUERY PLAN                  
---------------------------------------------
 Bitmap Heap Scan on roaring_test
   Recheck Cond: (val = 1)
   ->  Bitmap Index Scan on roaring_test_idx
         Index Cond: (val = 1)
(4 rows)

-- ----------------------------------------------------------------
-- 3. NULL values are not indexed (seq scan required for IS NULL)
-- ----------------------------------------------------------------
RESET enable_seqscan;
INSERT INTO roaring_test VALUES (7, NULL);
SELECT count(*) AS cnt_null FROM roaring_test WHERE val IS NULL;
 cnt_null 
----------
        1
(1 row)

-- ----------------------------------------------------------------
-- 4. Pending list visible within the same transaction
-- ----------------------------------------------------------------
SET enable_seqscan = off;
INSERT INTO roaring_test VALUES (8, 4), (9, 4), (10, 4);  -- val=4: pending
SELECT count(*) AS cnt_val4_pending FROM roaring_test WHERE val = 4;
 cnt_val4_pending 
------------------
                3
(1 row)

-- Mixed: val=1 has 2 rows in main index + 1 new row in pending.
INSERT INTO roaring_test VALUES (11, 1);
SELECT count(*) AS cnt_val1_mixed FROM roaring_test WHERE val = 1;
 cnt_val1_mixed 
----------------
              3
(1 row)

-- ----------------------------------------------------------------
-- 5. VACUUM merges pending list into main index
-- ----------------------------------------------------------------
VACUUM roaring_test;
SELECT count(*) AS cnt_val1_post_merge FROM roaring_test WHERE val = 1;
 cnt_val1_post_merge 
---------------------
                   3
(1 row)

SELECT count(*) AS cnt_val4_post_merge FROM roaring_test WHERE val = 4;
 cnt_val4_post_merge 
---------------------
                   3
(1 row)

-- ----------------------------------------------------------------
-- 6. ambulkdelete: partial delete then VACUUM
-- ----------------------------------------------------------------
DELETE FROM roaring_test WHERE id = 1;  -- remove one val=1 row (id=1)
VACUUM roaring_test;
SELECT count(*) AS cnt_val1_partial FROM roaring_test WHERE val = 1;
 cnt_val1_partial 
------------------
                2
(1 row)

-- ----------------------------------------------------------------
-- 7. ambulkdelete: delete all rows for a value
-- ----------------------------------------------------------------
DELETE FROM roaring_test WHERE val = 2;
VACUUM roaring_test;
SELECT count(*) AS cnt_val2_deleted FROM roaring_test WHERE val = 2;
 cnt_val2_deleted 
------------------
                0
(1 row)

-- ----------------------------------------------------------------
-- 8. Delete-all then reinsert (empty-bitmap + pending-merge path)
-- ----------------------------------------------------------------
DELETE FROM roaring_test WHERE val = 3;
INSERT INTO roaring_test VALUES (20, 3), (21, 3);  -- 2 new rows via pending
VACUUM roaring_test;
SELECT count(*) AS cnt_val3_reinserted FROM roaring_test WHERE val = 3;
 cnt_val3_reinserted 
---------------------
                   2
(1 row)

-- val=4 unaffected throughout
SELECT count(*) AS cnt_val4_stable FROM roaring_test WHERE val = 4;
 cnt_val4_stable 
-----------------
               3
(1 row)

-- ----------------------------------------------------------------
-- 9. int4 operator class
-- ----------------------------------------------------------------
CREATE TABLE roaring_int4 (val int4);
INSERT INTO roaring_int4 SELECT generate_series(1, 5);
CREATE INDEX roaring_int4_idx ON roaring_int4 USING roaring (val);
VACUUM roaring_int4;
SELECT count(*) AS cnt_int4_3  FROM roaring_int4 WHERE val = 3;   -- 1
 cnt_int4_3 
------------
          1
(1 row)

SELECT count(*) AS cnt_int4_10 FROM roaring_int4 WHERE val = 10;  -- 0
 cnt_int4_10 
-------------
           0
(1 row)

-- ----------------------------------------------------------------
-- Cleanup
-- ----------------------------------------------------------------
RESET enable_seqscan;
DROP TABLE roaring_test;
DROP TABLE roaring_int4;
